{
  "schemaVersion": 1,
  "intakeId": "org.example.intake-one",
  "intakeRevision": 1,
  "applicationStateHistory": [
    {
      "state": "Received",
      "changedAt": "2026-08-31T00:00:00Z",
      "responsibleRole": "role.windows-compatibility-maintainer"
    }
  ],
  "provider": {
    "providerId": "org.example.provider",
    "maintainerRef": "role.provider-maintainer",
    "publicContactRef": "channel.public-intake",
    "securityContactRef": "channel.private-security"
  },
  "components": [
    {
      "uiId": "org.example.webui",
      "uiVersion": "1.0.0",
      "sourceRev": "abcdef0",
      "sourceCommit": "0123456789abcdef0123456789abcdef01234567",
      "buildSource": "repo:example/webui"
    }
  ],
  "descriptor": {
    "schemaId": "https://schemas.dshwindowslauncher.invalid/webui-compatibility-descriptor.schema.json",
    "contractVersion": "1.1.0",
    "canonicalSha256": "1111111111111111111111111111111111111111111111111111111111111111"
  },
  "baseline": {
    "harnessCommit": "0a53fb55bea101816fa226bb964ae2bed71c343b",
    "lanPluginVersion": "1.2.1",
    "routeVersion": "example-route-1",
    "deploymentRef": "deployment.example-one"
  },
  "ownerAttestations": {
    "routeOwnerRef": "role.route-owner",
    "hostOrigin": {
      "status": "asserted",
      "evidenceRef": "evidence.host-origin"
    },
    "session": {
      "status": "asserted",
      "evidenceRef": "evidence.session"
    },
    "csrf": {
      "status": "asserted",
      "evidenceRef": "evidence.csrf"
    },
    "dataAuthorization": {
      "status": "asserted",
      "evidenceRef": "evidence.data-authorization"
    },
    "errorSemantics": {
      "status": "asserted",
      "evidenceRef": "evidence.error-semantics"
    }
  },
  "capabilitySlices": [
    {
      "adapterKey": "example.catalog",
      "purpose": "Load reviewed catalog images.",
      "capabilityIds": [
        "external-reviewed-passive-resource"
      ]
    }
  ],
  "externalDependencies": [
    {
      "ownerRef": "role.external-dependency-owner",
      "purpose": "Serve reviewed catalog images.",
      "origin": "https://assets.example.test:443",
      "paths": [
        "/catalog/images/"
      ],
      "methods": [
        "GET",
        "HEAD"
      ],
      "resourceTypes": [
        "image"
      ],
      "redirectPolicy": "none",
      "stateDependency": "No launcher-managed state.",
      "exitPlan": "Disable the adapter key in the next provider revision."
    }
  ],
  "conditionalCapabilityRequests": [],
  "providerSuite": {
    "suiteId": "org.example.provider-suite",
    "version": "1.0.0",
    "command": "pwsh -File ./verify-provider.ps1",
    "fixtureSha256": "2222222222222222222222222222222222222222222222222222222222222222",
    "expectedResultSha256": "3333333333333333333333333333333333333333333333333333333333333333"
  },
  "risk": {
    "dataClassification": "public",
    "privacyImpact": "No user data leaves the target origin in this example.",
    "threatModelRef": "threat-model.example-one",
    "knownLimitations": [
      "This is a non-production example identity."
    ],
    "exitPlan": "Withdraw the example intake and publish no production rule."
  },
  "supportCommitment": {
    "supportWindow": "Example only; no formal support.",
    "changeNoticeChannel": "channel.example-change-notice",
    "maintenanceOwnerRef": "role.provider-maintainer",
    "maintenanceEndsWhen": "The example is superseded."
  }
}
